{
  "id": "novasaga-sample",
  "name": "NovaSaga",
  "version": "0.3.0",
  "entities": [
    {
      "id": "sunset-moonland",
      "kind": "place",
      "name": "Sunset Moonland",
      "subtitle": "A place where exhausted travelers can begin to belong again.",
      "status": "developing",
      "summary": "A lakeside community shaped across centuries by exile, rediscovery and people arriving after the Cessation with nowhere else that could hold them.",
      "body": [
        "Sunset Moonland matters because it does not solve the world outside it. It simply proves that another way of living can still exist inside the same broken world.",
        "For Lucas and Teo, the settlement becomes less a destination than an answer to two different kinds of exhaustion: one caused by feeling too much, the other by seeing too far ahead."
      ],
      "timeline": [
        { "id": "sm-1", "title": "The exiled Luminary child", "order": 1, "dateLabel": "≈ 500 years before", "summary": "An unworthy child withdraws to the land, changes slowly, and is eventually welcomed back." },
        { "id": "sm-2", "title": "The fisherman returns", "order": 2, "dateLabel": "Before the Cessation", "summary": "A storm reveals the place. He later comes back with his wife to stay." },
        { "id": "sm-3", "title": "A community grows", "order": 3, "dateLabel": "After the Cessation", "summary": "Travelers arrive. The settlement grows without becoming an institution first." },
        { "id": "sm-4", "title": "Lucas and Teo arrive", "order": 4, "dateLabel": "Months later", "summary": "Their journey home changes when they discover a place that already feels like an answer." }
      ],
      "tags": ["community", "water", "belonging"],
      "visual": { "atmosphere": "warm", "luminosity": "bright", "density": "spacious", "motion": "gentle", "materiality": "natural" },
      "meaning": {
        "tensions": ["home vs destination", "scarcity vs kindness"],
        "desiredFeelings": ["relief", "belonging", "quiet wonder"],
        "realization": "A place becomes home through the quality of relationships rather than origin.",
        "explicit": false
      }
    },
    {
      "id": "lucas-menezes",
      "kind": "person",
      "name": "Lucas Menezes",
      "subtitle": "He feels the need before he feels his own exhaustion.",
      "status": "developing",
      "summary": "A 22-year-old environmental engineering student from Salvador whose instinct to help is both his magnetism and his burden.",
      "body": [
        "Lucas is defeated by scale rather than cruelty. The more he helps, the more clearly he sees the need that remains.",
        "His arc is not learning to care less. It is discovering that feeling another person's pain does not create an obligation to personally solve everything."
      ],
      "tags": ["Sunset Moonland", "Brazil", "empathy"],
      "visual": { "atmosphere": "warm", "luminosity": "bright", "density": "spacious", "motion": "gentle", "materiality": "natural" },
      "meaning": {
        "tensions": ["compassion vs self-erasure", "helping vs fixing"],
        "desiredFeelings": ["empathy", "frustration", "admiration", "relief"],
        "realization": "Feeling deeply does not require carrying everything.",
        "explicit": false
      }
    },
    {
      "id": "teo-duarte",
      "kind": "person",
      "name": "Mateus “Teo” Duarte",
      "subtitle": "He reads people quickly enough to find a path through them.",
      "status": "developing",
      "summary": "A 21-year-old marine biology student from Florianópolis with an unusual ability to understand people and convert that perception into movement.",
      "body": [
        "Teo can find an angle through almost any individual interaction, but a bureaucracy has no emotional state for him to read.",
        "Where Lucas absorbs pain, Teo converts patterns into navigation. Their friendship works because each corrects the other's blind spot."
      ],
      "tags": ["Sunset Moonland", "Brazil", "connection"],
      "visual": { "atmosphere": "serene", "luminosity": "bright", "density": "balanced", "motion": "gentle", "materiality": "natural" },
      "meaning": {
        "tensions": ["connection vs systems", "navigation vs grounding"],
        "desiredFeelings": ["confidence", "curiosity", "affection"],
        "realization": "Reading people becomes most powerful where the system is built from relationships.",
        "explicit": false
      }
    },
    {
      "id": "cessation",
      "kind": "event",
      "name": "The Cessation",
      "subtitle": "The day engineered electrical civilization stopped.",
      "status": "canon",
      "summary": "A celestial disturbance disrupts engineered electrical conduction globally while biological electrochemistry continues. Dark Beings amplify the collapse.",
      "body": [
        "The Cessation is not a clean apocalypse. It is a systems failure whose first consequences are ordinary: water pumps, hospitals, food, transport, communication and trust.",
        "At the same time, protections around hidden places weaken. The visible world becomes less certain precisely when people have the least capacity to interpret what they are seeing."
      ],
      "timeline": [
        { "id": "cess-1", "title": "Celestial disturbance", "order": 1, "summary": "Multiple extreme space-weather conditions converge." },
        { "id": "cess-2", "title": "Engineered conduction fails", "order": 2, "summary": "Grids, electronics, batteries and communication stop functioning." },
        { "id": "cess-3", "title": "Fear compounds failure", "order": 3, "summary": "Dark Beings amplify already unstable emotional fields." },
        { "id": "cess-4", "title": "Local worlds replace distant systems", "order": 4, "summary": "Water, food, practical knowledge and trust become immediate infrastructure." }
      ],
      "tags": ["world event", "collapse", "ambiguity"],
      "visual": { "atmosphere": "tense", "luminosity": "balanced", "density": "balanced", "motion": "active", "materiality": "industrial" },
      "meaning": {
        "tensions": ["dependence vs capability", "panic vs cooperation"],
        "desiredFeelings": ["disorientation", "scale", "human vulnerability"],
        "realization": "When scaffolding disappears, character and local capability become visible.",
        "explicit": false
      }
    },
    {
      "id": "luminaries",
      "kind": "faction",
      "name": "The Luminaries",
      "subtitle": "A hidden tradition concerned with balance rather than rule.",
      "status": "canon",
      "summary": "An ancient lineage that treats power as disciplined relation between consciousness, emotion, environment and matter.",
      "body": [
        "Luminaries do not define themselves through spectacle. Their central discipline is restraint: observe first, understand the field, and intervene only when the action preserves agency rather than replacing it.",
        "Their hidden settlements, outposts and practices exist to sustain knowledge that becomes dangerous when separated from responsibility."
      ],
      "tags": ["balance", "restraint", "hidden order"],
      "visual": { "atmosphere": "mysterious", "luminosity": "balanced", "density": "spacious", "motion": "gentle", "materiality": "architectural" },
      "meaning": {
        "tensions": ["power vs restraint", "guidance vs control"],
        "desiredFeelings": ["curiosity", "trust", "awe without worship"],
        "realization": "Greater capability increases responsibility rather than entitlement.",
        "explicit": false
      }
    },
    {
      "id": "silent-proving",
      "kind": "concept",
      "name": "The Silent Proving",
      "subtitle": "Worthiness observed in an ordinary life.",
      "status": "canon",
      "summary": "A Luminary child grows up without knowledge of their lineage. Character is observed through genuine choices, not manufactured tests.",
      "body": [
        "The Proving is deliberately invisible to the child. School, friendships, mistakes and difficulty must remain real because a staged trial would only measure performance.",
        "Only after readiness is established does the hidden lineage become known."
      ],
      "process": [
        { "id": "prove-1", "title": "Birth", "summary": "A child is born into a Luminary family, but inheritance grants no right to knowledge." },
        { "id": "prove-2", "title": "Ordinary life", "summary": "The family lives among ordinary humans. The child's choices remain genuinely their own." },
        { "id": "prove-3", "title": "Silent observation", "summary": "Character is read through natural responses to love, difficulty and responsibility." },
        { "id": "prove-4", "title": "Return — or not", "summary": "The lineage is revealed only when the person is genuinely ready." }
      ],
      "tags": ["selection", "character", "agency"],
      "visual": { "atmosphere": "austere", "luminosity": "bright", "density": "balanced", "motion": "still", "materiality": "architectural" },
      "meaning": {
        "tensions": ["inheritance vs earned character", "love vs duty"],
        "desiredFeelings": ["unease", "respect", "reflection"],
        "realization": "Being born near power does not make someone worthy of it.",
        "explicit": false
      }
    },
    {
      "id": "obscured-canvas",
      "kind": "concept",
      "name": "The Obscured Canvas",
      "subtitle": "The dots are real. They are not the whole paper.",
      "status": "canon",
      "summary": "Reality is imagined as a white canvas beneath the accumulated dots of science, religion, culture, philosophy and personal experience.",
      "body": [
        "Every system maps something real. The mistake begins when the visible marks are mistaken for the whole surface.",
        "Luminaries are not omniscient. Their difference is that they remain aware of the white space between what has already been named."
      ],